{
  "$schema": "strategy",
  "name": "StrategyAH2Earncy",
  "description": "Lends {{tokens}} on Alpha Homora v2 to generate interest. Users of Alpha Homora borrow {{tokens}} to perform leveraged yield-farming on Alpha\u2019s platform.",
  "author": "unknown",
  "authorUri": "https://twitter.com/"
}
