{
  "$schema": "strategy",
  "name": "StrategyIdle",
  "description": "This strategy supplies {{tokens}} on IDLE.finance to farm COMP and IDLE. Rewards are harvested, sold for more {{tokens}}, and deposited back to the vault.",
  "author": "Emiliano Bonassi",
  "authorUri": "https://twitter.com/emilianobonassi"
}
